{
  "id": "documenso",
  "name": "Documenso",
  "tagline": "E-signing where the key that seals the document is one you generated and keep, on a server you run.",
  "repo": "documenso/documenso",
  "site": "https://documenso.com",
  "license": "AGPL-3.0",
  "category": "files-docs",
  "resources": {
    "ram_min_mb": 2048,
    "disk_gb": 10,
    "arm64": true,
    "containers": 2,
    "external_db": true
  },
  "provenance": {
    "capability_seed": "caniselfhostit",
    "decision_layer": "original"
  }
}
