{
  "id": "memos",
  "name": "Memos",
  "tagline": "A private capture stream for the thought you would otherwise lose: markdown entries, tags and a timeline, from one container.",
  "repo": "usememos/memos",
  "site": "https://www.usememos.com",
  "license": "MIT",
  "category": "notes-wikis",
  "resources": {
    "ram_min_mb": 512,
    "disk_gb": 5,
    "arm64": true,
    "containers": 1,
    "external_db": false
  },
  "provenance": {
    "capability_seed": "caniselfhostit",
    "decision_layer": "original"
  }
}
